{
  "_comment": "Feature 追踪矩阵。用于把需求、设计、任务、代码、测试和 evidence 关联起来。Markdown 版本给人看，JSON 版本给命令和审计逻辑读取。",
  "featureId": "<FEATURE-ID>",
  "version": 1,
  "links": [
    {
      "_comment": "一条 link 表示一个需求到设计、任务、代码、测试和 evidence 的追踪关系。实现和验证过程中应逐步补全 code、tests 和 evidence。",
      "requirementId": "REQ-001",
      "designIds": ["DES-001"],
      "taskIds": ["TASK-001"],
      "code": [],
      "tests": [],
      "evidence": [],
      "status": "pending"
    }
  ]
}
